EIN,Organization,Mission,Receipts,URL,Guidestar
91-1663695,Bill & Melinda Gates Foundation Trust,"The foundation conducts all operations and grantmaking work and is the entity from which all grants are made. Bill, Melinda, and Warren are the trustees for the foundation. Warren has no involvement in the investment of the endowment through the Foundation Trust, including decisions that might be made regarding Berkshire Hathaway Inc. stock.     Because Bill, Melinda, and Warren believe the right approach is to focus the foundation’s work in the 21st century, we will spend all of our resources within 20 years after Bill's and Melinda's deaths. In addition, Warren has stipulated that the proceeds from the Berkshire Hathaway shares he still owns upon his death are to be used for philanthropic purposes within 10 years after his estate has been settled.     The decision to use all of the foundation’s resources in this century underscores our optimism for progress and determination to do as much as possible, as soon as possible, to address the comparatively narrow set of issues we’ve chosen to focus on.",65351324539,http://www.gatesfoundation.org/Who-We-Are/General-Information/Financials/Foundation-Trust,https://www.guidestar.org/profile/91-1663695
56-2618866,BILL & MELINDA GATES FOUNDATION,"Guided by the belief that every life has equal value, the Bill & Melinda Gates Foundation works to help all people lead healthy, productive lives. In developing countries, it focuses on improving people's health and giving them the chance to lift themselves out of hunger and extreme poverty. In the United States, it seeks to ensure that all people—especially those with the fewest resources—have access to the opportunities they need to succeed in school and life. Based in Seattle, Washington, the foundation is led by CEO Dr. Susan Desmond-Hellmann and Co-chair William H. Gates Sr., under the direction of Bill and Melinda Gates and Warren Buffett.",5314504955,http://www.gatesfoundation.org/,https://www.guidestar.org/profile/56-2618866
23-7093598,John D. and Catherine T. MacArthur Foundation,"The John D. and Catherine T. MacArthur Foundation supports creative people and effective institutions committed to building a more just, verdant, and peaceful world.",2120009347,www.macfound.org,https://www.guidestar.org/profile/23-7093598
91-0793881,Casey Family Programs,"Casey Family Programs is the nation's largest operating foundation focused on safely reducing the need for foster care and building Communities of Hope for children and families across America.  Founded in 1966, we work in all 50 states, the District of Columbia and two territories and with more than a dozen tribal nations to influence long-lasting improvements to the safety and success of children, families and the communities where they live.",1522909925,www.casey.org,https://www.guidestar.org/profile/91-0793881
65-0464177,"John S. and James L. Knight Foundation, Inc.","Knight Foundation is a national foundation with strong local roots. We invest in journalism, in the arts, and in the success of cities where brothers John S. and James L. Knight once published newspapers. Our goal is to foster informed and engaged communities, which we believe are essential for a healthy democracy.",1421523951,http://www.knightfoundation.org,https://www.guidestar.org/profile/65-0464177
13-1628151,Carnegie Corporation of New York,"Carnegie Corporation of New York was created by Andrew Carnegie in 1911 to promote ""the advancement and diffusion of knowledge and understanding.""  For over 95 years the Corporation has carried out Carnegie's vision of philanthropy by building on his tow major concerns:  international peace and advancing education and knowledge.",1163012280,http://www.carnegie.org/,https://www.guidestar.org/profile/13-1628151
90-0747216,The Jpb Foundation,"To enhance the quality of life in the United States through transformational initiatives that promote the health of our communities by creating opportunities for those living in poverty, enabling pioneering medical research, and enriching and sustaining our environment.",1092968332,http://jpbfoundation.org/,https://www.guidestar.org/profile/90-0747216
23-7047034,THE EDNA MCCONNELL CLARK FOUNDATION,The Edna McConnell Clark Foundation champions economically disadvantaged youth. We partner with other investors to expand programs with compelling evidence in order to help more vulnerable young people become successful adults.,1075500287,www.emcf.org,https://www.guidestar.org/profile/23-7047034
95-1790021,J Paul Getty Trust,"The J. Paul Getty Trust is an international cultural and philanthropic organization serving both general audiences and specialized professionals. Educational in purpose and character, the Getty focuses on the visual arts in all of their dimensions and their capacity to strengthen and inspire aesthetic and humanistic values. The Getty makes a difference by weaving together the presentation, enjoyment, study, and conservation of the visual arts in order to increase the public's knowledge an sensitivity, expand its awareness and creativity, sharpen its understanding and caring -- all with the conviction that cultural enlightenment and community involvement in the arts can help lead to a more civil society.",943547163,www.getty.edu,https://www.guidestar.org/profile/95-1790021
13-7043679,Doris Duke Charitable Foundation,"The mission of the Doris Duke Charitable Foundation is to improve the quality of people's lives through grants supporting the performing arts, environmental conservation, medical research and child well-being, and through preservation of the cultural and environmental legacy of Doris Duke's properties.",745072829,http://www.ddcf.org,https://www.guidestar.org/profile/13-7043679
95-4523232,California Endowment,"The California Endowment, a private, statewide health foundation, was established in 1996 to expand access to affordable, quality health care for underserved individuals and communities, and to promote fundamental improvements in the health status of all Californians. Headquartered in downtown Los Angeles, The Endowment has regional offices in Sacramento, Oakland, Fresno and San Diego, with program staff working throughout the state. The Endowment challenges the conventional wisdom that medical settings and individual choices are solely responsible for people's health. The Endowment believes that health happens in neighborhoods, schools, and with prevention.",596345874,www.calendow.org,https://www.guidestar.org/profile/95-4523232
38-1359264,W.K. Kellogg Foundation,"The W.K. Kellogg Foundation supports children, families and communities as they strengthen and create conditions that propel vulnerable children to achieve success as individuals and as contributors to the larger community and society.",585316544,http://www.wkkf.org/,https://www.guidestar.org/profile/38-1359264
94-3397785,GORDON E AND BETTY I MOORE FOUNDATION,"We foster path-breaking scientific discovery, environmental conservation, patient care improvements, and preservation of the special character of the Bay Area.",554138645,https://www.moore.org/,https://www.guidestar.org/profile/94-3397785
13-1635260,The Commonwealth Fund,"The Commonwealth Fund is a private foundation that aims to promote a high performing health care system that achieves better access, improved quality, and greater efficiency, particularly for society's most vulnerable.",528829688,http://www.commonwealthfund.org/,https://www.guidestar.org/profile/13-1635260
74-6013920,Houston Endowment Inc,Houston Endowment enriches the Greater Houston area by supporting a broad spectrum of charitable organizations.,491839715,http://www.houstonendowment.org,https://www.guidestar.org/profile/74-6013920
13-1760106,"Rockefeller Brothers Fund, Inc.","The Rockefeller Brothers Fund advances social change that contributes to a more just, sustainable, and peaceful world.",485963029,www.rbf.org,https://www.guidestar.org/profile/13-1760106
51-6017929,"F.M. Kirby Foundation, Inc.","The F. M. Kirby Foundation aims effectively to manage and utilize that which has been entrusted to it over multiple generations of the Kirby family. It strives to make thoughtful and prudent philanthropic commitments to highly selective grantee partners. The goal is to invest in opportunities that foster self-reliance or otherwise create strong, healthy communities.  The Board of Directors recognizes that achieving its philanthropic aspirations takes time, effort and perseverance that often result in sustained funding relationships.",463219509,www.fmkirbyfoundation.org,https://www.guidestar.org/profile/51-6017929
74-6036466,BROWN FOUNDATION INC,Philanthropy,432052848,NA,https://www.guidestar.org/profile/74-6036466
74-2568941,The Colorado Health Foundation,"The Colorado Health Foundation is singularly focused on helping Coloradans live their healthiest lives by advancing opportunities to pursue good health and achieve health equity through grantmaking, policy and advocacy, strategic private investments and convening to drive change. For more information, please visit www.coloradohealth.org.",354624406,http://coloradohealth.org,https://www.guidestar.org/profile/74-2568941
13-3794889,SIMONS FOUNDATION,The Simons Foundation’s mission is to advance the frontiers of research in mathematics and the basic sciences.,325585835,simonsfoundation.org,https://www.guidestar.org/profile/13-3794889
94-1236937,THE JAMES IRVINE FOUNDATION,Our mission is to expand opportunity for the people of California.,283574249,https://www.irvine.org/,https://www.guidestar.org/profile/94-1236937
11-3659133,The Skoll Foundation,"The Skoll Foundation advances systemic change to benefit communities around the world by investing in, connecting and celebrating social entrepreneurs.",275298925,www.skollfoundation.org,https://www.guidestar.org/profile/11-3659133
04-3073023,New Horizons at Choate Inc,Affordable retirement living,269229951,www.cummingsfoundation.org,https://www.guidestar.org/profile/04-3073023
93-0806316,MEYER MEMORIAL TRUST,"We work with and invest in organizations, communities, ideas and efforts that contribute to a flourishing and equitable Oregon.",262605614,www.mmt.org,https://www.guidestar.org/profile/93-0806316
13-6266964,Mary Flagler Cary Charitable Trust,provides financial support for charitable organizations,257350082,NA,https://www.guidestar.org/profile/13-6266964
95-3169713,Arnold and Mabel Beckman Foundation,"The Arnold and Mabel Beckman Foundation makes grants to program-related, non-profit research institutions to promote research in chemistry and the life sciences, broadly interpreted, and particularly to foster the invention of methods, instruments, and materials that will open up new avenues of research in science.",251352028,www.beckman-foundation.org,https://www.guidestar.org/profile/95-3169713
41-0719221,NORTHWEST AREA FOUNDATION,"The mission of the Northwest Area Foundation is to support efforts by the people, organizations and communities of our eight-state region to reduce poverty and achieve sustainable prosperity.  We fund champions of change who reflect the distinct cultural strengths of the eight states and 75 Native Nations of our region.  They work in diverse communities to help people build assets through good jobs and financial capability so that they can establish good credit, launch small businesses and save for their futures.  Together, these skills equip families to overcome crises today and begin to feel secure and hopeful about tomorrow.  Our region includes Idaho, Iowa, Minnesota, Montana, North Dakota, Oregon, South Dakota, Washington and the 75 Native Nations of our region.",250476798,www.nwaf.org,https://www.guidestar.org/profile/41-0719221
20-0721133,"Bank of America Charitable Foundation, Inc.",The mission of the Bank of America Charitable Foundation is to make a meaningful difference in the communities we serve by identifying local priorities and consistently delivering financial and human resources to address those challenges in order to build Neighborhood Excellence.,246460372,www.bankofamerica.com/foundation,https://www.guidestar.org/profile/20-0721133
20-4952986,Sea Change Foundation,"Founded in 2006 by Nat Simons and Laura Baxter-Simons as a private family foundation, Sea Change Foundation is dedicated to achieving meaningful social impact through strategic philanthropy that addresses the most pressing problems facing the world today. The Foundation is currently working to address the serious threats posed by global climate change, and primarily focuses on climate change mitigation and clean energy policy.",223805951,www.seachange.org,https://www.guidestar.org/profile/20-4952986
20-1980932,SCARLETT FAMILY FOUNDATION,"Vision: Our vision is that every student receives a high-quality education to reach their full potential and become self-sufficient.  Mission: We advocate, invest, and work to ensure that all students in Middle Tennessee have access to a high-quality education.",214714441,www.scarlettfoundation.org,https://www.guidestar.org/profile/20-1980932
36-2999442,Terra Foundation for American Art,"Recognizing the importance of experiencing original works of art, the foundation provides opportunities for interaction and study, beginning with the presentation and growth of its own art collection in Chicago. To further cross-cultural dialogue on American art, the foundation supports and collaborates on innovative exhibitions, research, and educational programs. Implicit in such activities is the belief that art has the potential both to distinguish cultures and to unite them.",193398025,www.terraamericanart.org,https://www.guidestar.org/profile/36-2999442
39-6037928,"Lynde and Harry Bradley Foundation, Inc.","Strengthen American democratic capitalism;  Support limited, competent government;  Support a dynamic marketplace for economic, intellectual, and cultural activity;  Defend, at home and abroad, American ideas and institutions;  Recognize that responsible self-government depends on enlightened citizens.",188476928,www.bradleyfdn.org,https://www.guidestar.org/profile/39-6037928
51-0066734,Longwood Foundation Inc,"To be thoughtful stewards of Pierre S. du Pont's legacy by being creative philanthropic leaders and providing support for Longwood Gardens.    “Philanthropic leadership” is:  1) continuously increasing the impact of our grant funds by:  a) selecting the requests with the greatest potential for impact through our grant review process.  b) creating opportunities to coordinate initiatives in a way that fits our mission and values (systemic investments).   2) being cognizant of and responsive to best practices in philanthropy.  3) being forthright about sharing the above. Longwood does not seek publicity, but is willing to share the reasoning behind our decisions with the interested parties.",175681549,NA,https://www.guidestar.org/profile/51-0066734
52-6036989,Morris and Gwendolyn Cafritz Foundation,"The Morris & Gwendolyn Cafritz Foundation is committed to building a stronger community for residents of the Washington, DC area through support of programs in arts and humanities, community services, education, and healthcare.",171649992,www.cafritzfoundation.org,https://www.guidestar.org/profile/52-6036989
39-1923558,KERN FAMILY FOUNDATION INC,"The Foundation enriches American lives by promoting the value of work, developing the formation of good character, increasing educational achievement – particularly in science, technology, engineering and math – and instilling an entrepreneurial mindset, especially in undergraduate engineering students.",166588611,www.kffdn.org,https://www.guidestar.org/profile/39-1923558
20-1173866,OMIDYAR NETWORK FUND INC,Omidyar Network creates opportunity for people to improve the quality of their lives.,163212224,http://www.omidyar.com,https://www.guidestar.org/profile/20-1173866
06-1695275,Craig H. Neilsen Foundation Inc,"The Craig H. Neilsen Foundation's mission is to improve the quality of life for those living with spinal cord injury and to support scientific exploration for effective therapies and treatments leading to a cure.    Our mission drives our approach to grantmaking efforts. Working in collaboration with leading researchers, clinicians and community advocates, the Neilsen Foundation funds spinal cord injury research, education and quality of life programs throughout the U.S. and Canada.    With this vision for the future, the Neilsen Foundation funds projects that are expected to:    -Lead to key discoveries through innovative and collaborative mechanistic, translational, preclinical and clinical research.  -Enhance standards for the delivery of care, particularly in the area of rehabilitation.  -Empower individuals with spinal cord injury to live independently in the community and enjoy improved emotional and physical     well-being.",163180516,www.chnfoundation.org,https://www.guidestar.org/profile/06-1695275
26-0316905,Peter G Peterson Foundation,"Our mission is to increase public awareness of the nature and urgency of key fiscal challenges threatening America's future and to accelerate action on them. To address these challenges successfully, we work to bring Americans together to find and implement sensible, long-term solutions that transcend age, party lines and ideological divides in order to achieve real results.",162896975,www.pgpf.org,https://www.guidestar.org/profile/26-0316905
04-6579815,Barr Foundation,"To invest in human, natural, and creative potential, serving as thoughtful stewards and catalysts.    Based in Boston, Barr focuses regionally, and selectively engages nationally, working in partnership with nonprofits, foundations, the public sector, and civic and business leaders to elevate the arts and creative expression, to advance solutions for climate change, and to connect all students to success in high school and beyond. With assets of $1.7 billion, Barr is among the largest private foundations in New England and has contributed more than $834 million to charitable causes since 1999.",160638309,https://www.barrfoundation.org,https://www.guidestar.org/profile/04-6579815
74-6385152,Albert & Bessie Mae Kronkosky Char Fndtn,"The mission of the Foundation is to produce profound good that is tangible and measurable in Bandera, Bexar, Comal and Kendall counties in Texas by implementing the Kronkosky's charitable purposes.",156030058,www.kronkosky.org,https://www.guidestar.org/profile/74-6385152
86-6247076,Virginia G Piper Charitable Trust 08-11-95,"Virginia G. Piper Charitable Trust is a private independent foundation honoring the philanthropic legacy of Virginia Galvin Piper(http://pipertrust.org/about-us/our-founder)  to enhance and strengthen the quality of life for the people in Maricopa County (Arizona) through support of:          Arts and Culture(http://www.pipertrust.org/our-grants/arts-culture)                  Children(http://www.pipertrust.org/our-grants/children/)                  Education(http://www.pipertrust.org/our-grants/education/)                  Healthcare and Medical Research(http://www.pipertrust.org/our-grants/healthcare-medical-research)                  Older Adults(http://www.pipertrust.org/our-grants/older-adults/)                  Religious Organizations(http://www.pipertrust.org/our-grants/religious-organizations)      By investing in nonprofits and encouraging strategic planning for the future, the Trust strives to make Maricopa County—a region that includes Phoenix and is home to nearly 4 million people—a stronger, healthier and more livable community.",155674170,http://www.pipertrust.org,https://www.guidestar.org/profile/86-6247076
94-3027928,The Lozier Foundation,"We provide operating and capital funds to human service organizations. We like agencies with annual operating budgets of at least $500k, prefer $1m or larger.  Our grants are generally linitied to the immediate Omaha area with a preference for the inner-city.    We do not accept unsolicited grants.",154844956,NA,https://www.guidestar.org/profile/94-3027928
94-3165171,TOSA FOUNDATION,****,152925849,NA,https://www.guidestar.org/profile/94-3165171
74-6047440,Nelda C. and H.J. Lutcher Stark Foundation,"The Nelda C. and H. J. Lutcher Stark Foundation is a private operating foundation established in 1961 to encourage and assist education and to improve and enrich the quality of life in Southeast Texas.         The Stark Foundation seeks to continue the legacy of its founders through the programs of: the Stark Museum of Art, the W.H. Stark House, the Frances Ann Lutcher Theater for the Performing Arts, and Shangri La Botanical Gardens and Nature Center, as well as the Miriam Lutcher Stark Contest in Reading and Declamation, a qualified scholarship program for public high school students in Orange County, Texas.         These venues, programs and activities provide the community and region with rich resources and opportunities for study and enjoyment of the arts, history and nature.",152740258,http://www.starkfoundation.org,https://www.guidestar.org/profile/74-6047440
36-6079185,Joyce Foundation,"The Joyce Foundation is a nonpartisan, private foundation that invests in public policies to improve quality of life, promote safe and healthy communities, and build a just society in the Great Lakes region. It works to achieve these goals by supporting policies to advance racial equity and economic mobility for the next generation in six states – Illinois, Indiana, Michigan, Minnesota, Ohio, and Wisconsin. It works in five program areas: Education & Economic Mobility, the Environment, Gun Violence Prevention & Justice Reform, Democracy, and Culture.",143816565,www.joycefdn.org,https://www.guidestar.org/profile/36-6079185
95-4292101,THE CALIFORNIA WELLNESS FOUNDATION,"To protect and improve the health and wellness of the people of California by increasing access to health care, quality education, good jobs, healthy environments and safe neighborhoods. This mission is pursued through the Advancing Wellness grants program, which is grounded in research related to the social determinants of health — where people live, and work, their race/ethnicity, and their income can impact their health and wellness.",141242690,http://www.calwellness.org/,https://www.guidestar.org/profile/95-4292101
31-1479839,Colcom Foundation,"The primary mission of Colcom Foundation is to foster a sustainable environment to ensure quality of life for all Americans by addressing major causes and consequences of overpopulation and its adverse effects on natural resources. Regionally, the Foundation supports conservation, environmental projects, and cultural assets.",139767767,colcomfdn.org,https://www.guidestar.org/profile/31-1479839
73-6097262,Masonic Charity Foundation of Oklahoma,"Dedicated to the tenets of Freemasonry, Brotherly Love, Relief and Truth, our leadership guides the course for our fraternal benevolence and provides stewardship for the legacy entrusted to us.     The Foundation's mission is to provide a network of programs supporting charitable and educational needs of Oklahomans from every walk of life while remaining firmly committed to Masonic tenets and our continuing legacy of leadership and stewardship.",138339597,http://www.mcfok.org/,https://www.guidestar.org/profile/73-6097262
06-1547852,Peter and Carmen Lucia Buck Foundation Inc,The PCLB Foundation was established in 1999 as a private family foundation with a commitment to enhancing and improving the quality of life in its communities through grants to qualified charitable organizations.,134284328,www.pclbfoundation.org,https://www.guidestar.org/profile/06-1547852
77-0560142,KAVLI FOUNDATION,"The Kavli Foundation is dedicated to advancing science for the benefit of humanity, promoting public understanding of scientific research, and supporting scientists and their work.     The Foundation's mission is implemented through an international program of research institutes, professorships, symposia and other initiatives in the fields of astrophysics, nanoscience, neuroscience and theoretical physics. The Foundation is also a founding partner of the Kavli Prizes, which recognize scientists for their seminal advances in astrophysics, nanoscience and neuroscience.",127683819,http://www.kavlifoundation.org/,https://www.guidestar.org/profile/77-0560142
20-7415160,PISCES FOUNDATION,"Our mission is to advance strategic solutions to natural resource challenges and prepare the next generation by supporting environmental learning. We collaborate, innovate, and work respectfully in our community.",124573375,http://piscesfoundation.org/,https://www.guidestar.org/profile/20-7415160
23-7000192,Bainum Family Foundation,"We operate and support educational programs and projects assisting underserved children and youth, from early childhood through post-secondary education.",123636348,https://bainumfdn.org/,https://www.guidestar.org/profile/23-7000192
13-3647019,F B HERON FOUNDATION,The Foundation was created in 1992 with the mission of helping people and communities to help themselves.,122521862,www.heron.org,https://www.guidestar.org/profile/13-3647019
41-0754835,MCKNIGHT FOUNDATION,"The McKnight Foundation, a Minnesota-based family foundation, seeks to improve the quality of life for present and future generations. Program interests include regional economic and community development, Minnesota’s arts and artists, education equity, youth engagement, Midwest climate and energy, Mississippi River water quality, neuroscience research, international crop research, and rural livelihoods.",122335659,www.mcknight.org,https://www.guidestar.org/profile/41-0754835
