EIN,Organization,Mission,Receipts,URL,Guidestar
27-5501471,Northeastern Pennsylvania Health Care Foundation,"Function As A Community Foundation That Supports The Health Care Needs Including But Not Limited To Health Education, Community Wellness, Payment For Medical Care Of Uninsured And Underinsured Regardless Of The Facility Of Treatment, And To Improve The Complete Physical, Mental, And Social Well-Being Of The Residents Of Lackawanna, Luzerne And Wyoming Counties.",3590663,N/A - NONE,https://www.guidestar.org/profile/27-5501471
27-3176380,Turtle Beach Wildlife Reserve,"Conduct Research And Educational Activities Related To Conserving, Protecting And Investigating Issues Of Biological Importance Related To Animal And Marine Life",3360372,NA,https://www.guidestar.org/profile/27-3176380
26-2813021,Venture Strategies Innovations,Venture Strategies Innovations (VSI) is a nonprofit organization committed to improving women’s health in developing countries by creating access to effective and affordable technologies on a large scale.,3330412,www.vsinnovations.org,https://www.guidestar.org/profile/26-2813021
13-6122092,"Julia & Seymour Gross Foundation, Inc.","Our mission is evolving. Currently children, education, science , medicine, environment.",3304069,NA,https://www.guidestar.org/profile/13-6122092
06-0662124,Eno Center for Transportation,"The Eno Center for Transportation (Eno) was founded in 1921 by William Phelps Eno (1859-1945), who pioneered the field of traffic management in the United States and Europe. Today, Eno focuses on all modes of transportation, with the mission of cultivating creative and to impact emerging issues for the nation's multi-modal transportation system. We pursue this mission by supporting activities in three areas: research and policy recommendations, professional development and leadership programs, and Eno Transportation Weekly, which is the go-to source for transportation news on the Hill.",3277395,http://www.enotrans.com,https://www.guidestar.org/profile/06-0662124
84-6154601,Muriel MacGrgor Charitable Trust,"The mission of the Trust is to continue operation of the MacGregor Ranch as a high mountain historic working cattle ranch and to support youth education.  This mission will be carried out by maintaining the presence of a cattle and horse herd, preservation and interpretation of historic buildings and educational tours.  The focus of the Ranch will be on quality experiences through respect for the land, the Ranch and its history for the future generations of tomorrow's leaders.",3274596,www.macgregorranch.org,https://www.guidestar.org/profile/84-6154601
81-0867152,Arriving Home Inc,"The Purpose Of Arriving Home, Inc. Is To Generate Funds For Housing To Be Available For The Faculty And Staff Of Catholic Schools And Parishes Who Have Moderate Income.",3270508,NA,https://www.guidestar.org/profile/81-0867152
03-0535585,Three Rivers Foundation for the Arts and Sciences Inc,To inspire lifelong learning through education in the arts and sciences.,3231551,www.3RF.org,https://www.guidestar.org/profile/03-0535585
46-0750517,Cook Museum of Natural Science,"“To engage, excite and educate visitors of all ages about the natural, created world around us.""",3213745,www.cookmuseum.org,https://www.guidestar.org/profile/46-0750517
43-1187852,National Museum of Toys and Miniatures,"The  National Museum of Toys and Miniatures’s (T/m) mission is to educate, inspire, and delight adults and children through the museum's collection and  preservation of toys and miniatures. T/m exhibits and preserves one of the  nation's largest collections of antique toys and the world's largest collection of fine-scale miniatures.At a time when museums housing collections of our type are closing nationwide, we are working to improve our interpretation and education to share the history of the common experience of playing with toys and the growing art form of fine-scale miniatures with a local and national audience. The museum is a portal to the past, a chronicle of the ways that our imaginations have served us over time. Children of all ages at all income levels have engaged in play across generations; the museum is a place for visitors to find common ground across generations, genders, and lifestyles. Our collection invites reminiscing, analysis, and discussion; it is a vehicle for building connections.",3178338,www.toyandminiaturemuseum.org,https://www.guidestar.org/profile/43-1187852
85-0309005,PNM RESOURCES FOUNDATION INC,"PNM Resources Foundation is dedicated to improving the quality of life in the communities served by the subsidiaries of PNM Resources.  The Foundation seeks opportunities for engaged philanthropy through a focus on education, environmental awareness and education, economic vitality and employee engagement.  Since 1983, the PNM Resources Foundation has helped improve the quality of life in New Mexico by supporting nonprofit organizations.  In 1983, PNM shareholders created the PNM Foundation as a separate, nonprofit, tax-exempt corporation governed by a board of trustees comprised of PNM employees. No customer funds are part of the PNM Resources Foundation endowment.",3139049,www.pnm.com/foundation,https://www.guidestar.org/profile/85-0309005
20-5133917,The Evans Foundation For Molecular Medicine,"The Evans Foundation for Molecular Medicine, established in 2006, promotes research into Multiple Systems Atrophy, rare neurodegenerative diseases, and other biotechnological fields, and seeks to make information on the disease, research progress, and patient care available to people living with MSA and their caregivers.",3112599,http://evansfmm.org,https://www.guidestar.org/profile/20-5133917
74-2869512,FOUNDATION FOR THE ADVANCEMENT OF CHRISTIANITY,Dissemination of God's Word  in print and digital media.,3068416,NA,https://www.guidestar.org/profile/74-2869512
47-4183567,BANFIELD FOUNDATION,"At the core of the Banfield Foundation, a 501(c)(3) nonprofit organization, is the belief that all pets deserve access to veterinary care. In support of this belief, the foundation funds programs that enable veterinary care, elevate the power of the human-animal bond, provide disaster relief for pets, and advance the science of veterinary medicine through fostering innovation and education. It also leverages the expertise and passion of Banfield Pet Hospital associates to care for pets in need. At the Banfield Foundation, we are committed to making a better world for pets because they make a better world for us. For more information, visit www.BanfieldFoundation.org, or follow us at www.Facebook.com/BanfieldFoundation",3050631,www.banfieldfoundation.org,https://www.guidestar.org/profile/47-4183567
46-0494578,PLAYA,"On the edge of the Great Basin, PLAYA provides space, solitude and creative community to residents working in the arts and sciences, encouraging dialogue to bring positive change to the environment and the world.      PLAYA is a retreat for creative individuals who are committed and passionate about their work, and who will benefit from time spent in a remote location. At PLAYA, we offer seclusion and quiet in a natural environment and the opportunity for interaction, if desired, with a cohort of residents and the local rural community. A residency provides the time and space to create substantive work or to research and reflect upon one's creative or scientific processes.",3033715,www.playasummerlake.org,https://www.guidestar.org/profile/46-0494578
85-0324203,Holistic Management International,The Holistic Management International mission is to educate people in regenerative agriculture for healthy land and thriving communities.,3003777,http://www.holisticmanagement.org,https://www.guidestar.org/profile/85-0324203
85-0484396,CON ALMA HEALTH FOUNDATION,"Con Alma Health Foundation is organized to be aware of and respond to the health rights and needs of the culturally and demographically diverse peoples and communities of New Mexico. Con Alma seeks to improve the health status and access to health care services for all New Mexican communities and advocates for a health policy that addresses the health needs of all in New Mexico. The Foundation makes grants, contributions, and program-related investments to fulfill its Mission.",2985972,conalma.org,https://www.guidestar.org/profile/85-0484396
39-1577653,Community Alternatives Inc,"Our mission is to encourage and promote the total integration of people who experience a disability to live as independently as possible in the community of their choice.   We start with the individual and identify their vision, their important relationships and their community interests and preferences. We work as a team to help the person achieve their own goals . We believe that the individual is the expert on what his or her life should look like.",2969303,http://newcommunityalternatives.com,https://www.guidestar.org/profile/39-1577653
74-2234944,Museum of Outdoor Arts,Making art a part of everyday life,2871119,http://moaonline.org,https://www.guidestar.org/profile/74-2234944
13-3781874,Coby Foundation Ltd,"The Coby Foundation, Ltd., funds projects in the textile and needle arts field. Its funding is limited to non-profit organizations in the Mid-Atlantic and New England. The majority of the Coby Foundation’s support goes to exhibitions and programs that combine excellent scholarship and effective interpretation. Projects may be in the arts or humanities, contemporary or historical, but all must have a public benefit. They may include research and documentation, conservation, publication and associated digital projects.",2862424,www.cobyfoundation.org,https://www.guidestar.org/profile/13-3781874
47-1903487,Devon Creek Foundation,The  mission of the Sly Wind Foundation is to create change to promote sustainability.,2852066,NA,https://www.guidestar.org/profile/47-1903487
20-3921057,JUST KEEP LIVIN FOUNDATION,"The just keep livin Foundation was founded by Camila and Matthew McConaughey with the mission to  empower high school students by providing them with the tools to lead active lives and make healthy choices for a better future. We run 32 afterschool fitness and wellness programs at Title 1 high schools throughout the country. In our programs, we encourage students to make positive life choices that improve their physical and mental health through exercise, teamwork, gratitude, nutrition, and community service. Participating students have a safe place to enhance their lives with fitness coaches and health experts. The results have been incredible. Participants get in shape and gain confidence while also improving their grades, attendance and behavior. Friendships are built and fears are over",2834606,www.jklivinfoundation.org,https://www.guidestar.org/profile/20-3921057
26-1993594,Neal Family Foundation,To be advocates to those with no advocates.,2792897,NA,https://www.guidestar.org/profile/26-1993594
04-2105936,"Mason Wright Foundation, Inc.",We provide independence and dignity for our region's neediest elderly through quality residential and lifecare services.,2782651,masonwrightfoundation.org,https://www.guidestar.org/profile/04-2105936
46-0634935,Cedar Lake Inc,Cedar Lake is a contemporary ballet company dedicated to the continued development of dance by providing choreographers a comprehensive environment for creation as well as curating work for presentation to a worldwide audience.,2760204,www.cedarlakedance.com,https://www.guidestar.org/profile/46-0634935
41-1588205,Winona Health Services Inc,"We are devoted to improving the health and well-being of our family, friends, and neighbors.",2682544,www.winonahealth.org,https://www.guidestar.org/profile/41-1588205
26-0056922,LANE MOTOR MUSEUM,"“The mission of Lane Motor Museum shall be to collect, preserve, document, and interpret an eclectic and technically interesting collection of cars and other transportation-related objects for the purposes of educating the public about the history of transportation.""",2666866,www.lanemotormuseum.org,https://www.guidestar.org/profile/26-0056922
61-1763737,POSTER HOUSE INC,"Poster House is dedicated to presenting the impact, culture, and design of posters, both as historical documents and methods of contemporary visual communication.",2663390,www.posterhouse.org,https://www.guidestar.org/profile/61-1763737
91-2084108,The Nysether Family Foundation,"Dedicated to improving the quality of life and  services available for local youth, seniors and developmentally challenged  individuals of all ages and preserving our quality of life by advocating the  intrinsic value of animal life in our environment and the conservation and  preservation of our natural landscapes while respecting the private property  rights of others.",2655339,NA,https://www.guidestar.org/profile/91-2084108
23-6207353,R K Laros Foundation 38526,"The R.K. Laros Foundation has a strong commitment to the Greater Bethlehem Community. Our goal is to provide grants to non-profit charitable organizations, where those grants will either seed or support programs that might not otherwise occur. We focus on initiatives that will have a continuing benefit to the community and the people it serves.",2633463,http://www.larosfoundation.org/,https://www.guidestar.org/profile/23-6207353
13-4096155,The Build Now Foundation Inc,"Build Now is a non-profit organization dedicated to helping residents rebuild New Orleans greener, smarter, and . . . now!",2591537,www.buildnownola.com,https://www.guidestar.org/profile/13-4096155
46-2090563,FOSTER PARENT TRAINING CENTER FOR HOMES OF HOPE,"Foster Parent Training Center for Homes of Hope supports children and families through continuous training, education, and development. We are committed to operating in the spirit of excellence by providing exceptional service to all of our clients and partners. We strive to meet the special and unique needs of those we serve in a professional, comprehensive, caring, and gracious manner; because no one is beyond hope.",2581499,NA,https://www.guidestar.org/profile/46-2090563
94-2412399,"LOEL FOUNDATION, Inc.","Enrich the lives of Seniors in the greater Lodi area by providing programs that support their nutritional, social, and housing needs, in partnership with our community.",2552336,www.loelcenter.net,https://www.guidestar.org/profile/94-2412399
51-0280202,LIVINGSTON RIPLEY WATERFOWL CONSERVANCY INC,"The mission of Livingston Ripley Waterfowl Conservancy (LRWC) is to conserve waterfowl and wetlands through research, education, and conservation action.    Each part of the Conservancy's three-fold mission benefits from and compliments the others while furthering LRWC's goal of protecting waterfowl and wetlands. All three programs integrate the Conservancy's historical and present-day connection to aviculture while furthering the collective knowledge of, awareness of, and concern for waterfowl and the habitats in which they live.",2549634,www.lrwc.net,https://www.guidestar.org/profile/51-0280202
20-5900630,The Micah 6:8 Foundation,We provide funding to non profit organizations which are doing sustainable international development.,2528612,NA,https://www.guidestar.org/profile/20-5900630
27-2753994,"PUFFIN FOUNDATION WEST, LTD.","Puffin Foundation West, Ltd.  (PFW) seeks to open the doors of artistic expression by providing grants to activist artists and Not For Profits organizations that often are excluded from mainstream opportunities due to race, gender, or social philosophy. We know that Artists and the universal language of ART   are able to reach across both physical borders and the boundaries of our imagination and in doing so are often able to peaceably transform our society's ideas about social and civil justice issues.  Creative expression and innovation have always helped move society towards a more progressive democracy and allows us to recognize our universal humanity. Puffin Foundation West, Ltd. is committed to supporting such grass-roots artists and organizations.",2491164,http://www.puffinwest.org/,https://www.guidestar.org/profile/27-2753994
31-0996772,Miami Valley Research Foundation,"To Foster And Promote Research, Technological, Scientific And Educational Activities And To Create And Preserve Jobs And Employment Opportunities To Improve The Economic Welfare Of The Greater Dayton Area.",2486317,WWW.THERESEARCHPARK.COM,https://www.guidestar.org/profile/31-0996772
20-4083846,In A Perfect World Foundation,"The In a Perfect World Foundation is a nonprofit organization dedicated to empowering the next generation by creating and supporting programs that provide education, mentoring and artistic expression to underserved and at-risk youth around the world.",2458293,www.iapw.org,https://www.guidestar.org/profile/20-4083846
20-6424699,Zeitgeist Center for Arts and Community,"Zeitgeist is a nonprofit arts and community development organization.  We are committed to growing healthy, connected community empowered to create and thrive.   Working in partnership across our region, Zeitgeist connects like-minded organizations and people to collaboratively create programs that make lasting change in our area.  We host a Cafe that serves fresh, often local food, a two-screen movie theater called the Zinema that shows independent films and a 120 person black box theater that hosts a full season of theater with our Renegade Theater Company.  Our community development work focuses on active transportation initiatives, health policy work and making sure everyone in our community has access to fresh and healthy food.",2441773,www.zeitgeistarts.com,https://www.guidestar.org/profile/20-6424699
22-3809406,American Academy of Continuing Medical Education Inc,"The purpose of the American Academy of CME’s Continuing Professional Education Program is to:    • Offer CME/CNE/CPE/CE-certified (CE-certified) activities to physicians, pharmacists, nurses, registered dietitians, and other healthcare professionals.  At least 5% of all activities will be developed and certified as multidisciplinary education.  • Serve as a resource and mentor for non-accredited medical education companies, professional healthcare organizations, governmental agencies, and international organizations.  • When appropriate, collaborate with other organizations to develop and implement CE-certified educational initiatives   • Implement CE-certified activities that complement the IOM’s competencies, develop, maintain, and improve the competence, professional performance, and/or patient care of health care professionals.  • To identify and initiate educational activities that are not aligned with any commercial support and will fulfill an “orphaned” educational need.    The characteristics of the content of the American Academy of CME’s activities will:  • Address gaps in learners’ knowledge, competence, and/or performance  • Incorporate levels of evidence for clinical presentations that is accepted within the professions of medicine, nursing, pharmacy, and nutrition and dietetics as adequate justification for their indications and contraindications in the care of patients.  • Ensure all scientific research referred to, reported on, or used in support or justification of patient care recommendations will conform to the generally accepted standards of experimental design, data collection, and analysis.  • Not recommend any treatment or manner of clinical practice that is not within the AMA’s, ACCME’s, ANA’s, ACPE’s, and/or CDR’s definition of continuing education; is known to have risks or dangers that outweigh the benefits; or is known to be ineffective in the treatment of patients.  • Incorporate non-educational strategies where appropriate into CE-certified activities    The American Academy of CME’s target audiences may include:  • Generalist, specialists, and/or subspecialists within the health care community (physicians, nurse practitioners, nurses, physician assistants, pharmacists, dietitians and allied health professionals).  • Hospital based, community based, and/or academic based  • Local, regional, national and international participants    Activities offered by the American Academy of CME include:  • Full-day and multi-day conferences and meetings  • Symposia in conjunction with national and regional meetings  • Local Grand Rounds  - may be presented at hospitals and healthcare professional association meetings  • Small group workshops  • Live and enduring web activities  • Enduring print materials  • Live and enduring teleconferences    Expected results of the American Academy of CME’s continuing education program are to:  • Increase learner knowledge and competence as they approach clinical decision making  • Change learner performance as measured through self-report in post-activity outcomes tools  • Change in healthcare systems as reported back to the Academy from CE,QI, and/or QA departments  • Identify barriers to change that may impede improvement by the health care professional and/or health care institutions.   • Offer information or further education that will assist overcoming those barriers that are within their control",2441089,www.academycme.org,https://www.guidestar.org/profile/22-3809406
62-6047678,"Stuttering Foundation of America, Inc.","Since 1947, the Stuttering Foundation has long led the way worldwide in providing accurate information and help on stuttering through 42 DVDs, 28 books, and 19 brochures. Publications have been translated into 22 languages and distributed to people in all 50 states and 122 countries. It runs extensive educational programs on stuttering and supports research into the causes of stuttering. Offers Web sites, www.stutteringheland toll-free numbers, 800-992-9392 and 800-967-7700. Organizes annual public awareness campaign to educate the public about this often-misunderstood disorder. Sponsors annual media award and Malcolm Fraser Award for excellence.",2434175,www.stutteringhelp.org,https://www.guidestar.org/profile/62-6047678
82-0381185,MORRISON CENTER ENDOWMENT FOUNDATION INC,"Our goal is to impact quality art performances at Idaho's premiere performing arts center. This is done by partnering to underwrite the operation expenses of the Velma V. Morrison Center, subsidizing rental rates to Idaho's local arts groups and sponsoring performances by high quality national and international artists.",2427552,NA,https://www.guidestar.org/profile/82-0381185
23-7297778,GOLDEN STATE HUMANE SOCIETY,"Provide low-cost spay, neuter and basic veterinary services with a focus on reducing the number of unwanted companion dogs and cats through birth control and humane education outreach.",2347086,https://www.goldenstatehumanesociety.com/,https://www.guidestar.org/profile/23-7297778
23-7072750,"Ezra Jack Keats Foundation, Inc.",To support art and literacy programming for children in public schools and public libraries in the U.S.,2341406,http://www.ezra-jack-keats.org,https://www.guidestar.org/profile/23-7072750
95-4635927,WALT DISNEY FAMILY FOUNDATION,"Walt Disney Family Foundation (“WDFF"" or “the Foundation"") is a private operating foundation incorporated as a nonprofit public benefit corporation in 1997 in the State of California. The specific and primary purpose of the Walt Disney Family Foundation is to assemble material, study, teach and preserve, and publish and display material appropriate to communicate the vision and legacy of Walt Disney within a historical context.    The Walt Disney Family Museum, Inc. (“WDFM""), is a charitable organization which owns and operates the Walt Disney Family Museum (“the Museum"").  The two entities are closely related through common purposes, shared facilities and management, and common control of the two entities' boards.  They work closely together to preserve, enhance and display the collection of art and historical items related to their missions and to ensure the continued maintenance and operation of the Museum and related educational and public programs.    Located in the San Francisco Bay Area classes and programs serve a broad spectrum of bay area youth and adults while museum visitors come from across the country and beyond.",2327236,waltdisney.org,https://www.guidestar.org/profile/95-4635927
22-2386955,Animal Farm Foundation Inc,"Securing equal treatment and opportunity for ""pit bull"" dogs.",2321735,www.animalfarmfoundation.org,https://www.guidestar.org/profile/22-2386955
46-1308435,Mentors,"Mentors Is Dedicated To Assisting People Through Transitions To Self-Sufficiency. There Are Many Paths To Self-Sufficiency, Among Them Financial, Educational, And Travel. Mentors Assists With The Means To Independence.",2310945,N/A,https://www.guidestar.org/profile/46-1308435
13-3922034,Calamus Foundation,"The Calamus Foundation offers support to  qualified charitable organizations working in two  areas. First, we support LGBT organizations working to promote the formation, growth, and well-being of their communities, with particular emphasis on social justice and civil rights. Second, we fund  non-LGBT organizations that advocate for social,  racial and economic justice and that integrate  LGBT protections into their work.",2292240,http://www.thecalamusfoundation.com/,https://www.guidestar.org/profile/13-3922034
16-1500454,T. Colin Campbell Center for Nutrition Studies,"Our mission is to promote optimal nutrition through science-based education, advocacy, and research. By empowering individuals and health professionals, we aim to improve personal, public, and environmental health.",2272624,http://nutritionstudies.org,https://www.guidestar.org/profile/16-1500454
