EIN,Organization,Mission,Receipts,URL,Guidestar
73-1592997,Michael & Jane Sigmon Family Foundation Inc,"The Michael & Jane Sigmon Family Foundation seeks to support activities that inspire and encourage youth in the areas of leadership, education, character development, as well as basic needs. The Foundation will also provide funds to support animal and wildlife care, community services, and international out-reach.",150010,NA,https://www.guidestar.org/profile/73-1592997
46-5618553,Aspen Strong Foundation,"Our Mission is to raise awareness and improve mental health in the Roaring Fork Valley by creating sustainable financial resources, by uniting professionals and agencies in mental health, and by supporting and implementing empirically-based and results-oriented education and action.",145276,www.aspenstrong.org,https://www.guidestar.org/profile/46-5618553
26-1716740,Realtor Foundation of Wake County,To improve housing solutions in Wake County,144218,www.rfowc.org,https://www.guidestar.org/profile/26-1716740
47-0888345,Israel at Heart,To Promote Better Understanding Of Israel,136784,NA,https://www.guidestar.org/profile/47-0888345
91-1906951,Seattle Urban Squash,"Our Vision: To impact the lifelong health, education and wellness of students through commitment, resilience, integrity and team-work.  Our Mission Statement: To offer a group of underprivileged students year-round individualized academic tutoring, intensive squash instruction and community service so that they can better recognize and fulfill their potential in life as students, athletes and citizens.",136341,http://www.SeattleSquash.org,https://www.guidestar.org/profile/91-1906951
94-3247917,Keller Housing Initiatives Inc,"To Provide Affordable Housing For Current Residents Of Keller Plaza In Oakland, Ca And For Future Low-Income Residents; To Provide Facilities And Services Related To Such Housing For Persons Described Above; (See Schedule O For Continuation) To Create And Maintain The Affordability Of Housing For The Person Described Above By Taking Action And Working With Concerned Private And Public Persons And Agencies.",135397,N/A,https://www.guidestar.org/profile/94-3247917
11-3152696,PRIMATE CONSERVATION INC,"Primate Conservation, Inc., (PCI) is an all volunteer not for profit foundation [501(c)(3)] dedicated to studying,  preserving and maintaining the habitats of the least known and most endangered primates in the world. Over 100 species, approaching half of all primates, are threatened or endangered. The tropical forests where most primates live are disappearing at an alarming rate.            Jane Goodall and others like her who have done field studies of primates in their natural habitat have shown that dedicated individuals are one of the keys to successful conservation. PCI provides grants to support the next generation of researchers and conservationists in the field. These grantees research the needs of species,  focusing the attention of  local people and the world. In many cases they are the endangered primates only defense against hunters and loggers.               PCI has also funded projects on better known species including orangutans, gorillas, bonobos and chimps.            In order to save this vast store house of the natural world's biodiversity, many more people need to be involved in conservation. The people PCI supports are committed to protect these species and their habitats. You can help PCI fund researchers in the tropical forests doing this important conservation work. Without their dedication under difficult physical conditions some of these endangered primates will be lost.        Over 86% of PCI's budget goes directly to field projects in habitat countries.            Your contributions are tax-deductible.",135034,"www.primate.org, www.AlltheWorldsPrimates.org",https://www.guidestar.org/profile/11-3152696
34-6509064,Boy Scouts of America Trust,"The Mission of the Boy Scouts of America is to prepare young people to make ethical choices over their lifetime by instilling in them the values of the Scout Oath and Law. To support Boy Scouts of America, visit www.give2bsa.org.",134675,http://www.BSA.scouting.org/,https://www.guidestar.org/profile/34-6509064
20-1822473,Akindale Thoroughbred Rescue,"Since its inception in April 2006, Akindale Thoroughbred Rescue  (ATBR) has rescued more than 100 horses directly from auction houses, such as New Holland, PA,  where they are destined for slaughter.  Many other horses have been shipped to Akindale from national organizations such as TRF and Mid Atlantic Horse Rescue because ATBR provides safe haven for horses that can no longer race, are in their prime, and are ready for new careers or to be companion animals.     Akindale is a nationally recognized name, synonymous with the cause.  While in the past ATRB has made valuable contributions in saving many thoroughbreds, there are so many more still needing to be rescued.    In order to fulfill its mission of ""providing a safe haven for thoroughbreds no longer able to race"" the ATBR has expanded its goals.  Realizing that more horses need to be responsibly adopted to private owners, so more can be taken in, they are committed to training and more aggressive communication about the adoption program.    This will require skilled staff, state of the art facilities and the generosity of the community of horse lovers.",133585,akindalehorserescue.org,https://www.guidestar.org/profile/20-1822473
47-2554837,The Fountain Charitable Foundation,"We believe that the issue facing most people with life controlling problems is the way the world tells us that we should live our lives. It is an unrealistic and unfulfilling. It leads to a life absent of peace, purpose, passion or the possibility of healthy relationships. This culture shift has led to many having unproductive and unsuccessful lives, filled with a buffet of addictions to drugs, alcohol, pornography, gambling, unhealthy relationships, etc.    We at Retrograde are attempting to reverse not just the symptoms of the problem, but to transform the hearts and minds of our students through teaching them healthy physical, mental and spiritual habits. We believe that in so doing we will be able to help others develop and maintain meaningfulHelping people in need around our community.",133371,http://www.retrogradeministries.com/,https://www.guidestar.org/profile/47-2554837
94-3237506,COOKSON RANCH FOUNDATION INC,To create lasting memories for children and adults alike.,131523,www.cooksonranch.org,https://www.guidestar.org/profile/94-3237506
04-3569658,"Seledorwon USA, Inc.","The mission of Seledorwon USA, INC. Sustainable Agricultural Development (SAD) program is to train 100 (one hundred) villagers per year modern agricultural skills that will lead to increase in food production in the Boinsen Statutory District, Bong County, Republic of Liberia, West Africa. By increasing food production to 30% (thirty percent) paddy rice, upland rice, cassavas, corn, yams, and sweet potatoes production in project year one and ongoing thereafter.",13e4,NA,https://www.guidestar.org/profile/04-3569658
76-6041172,Bay Area Council Boy Scouts of America Trust,"The Mission of the Boy Scouts of America is to prepare young people to make ethical choices over their lifetime by instilling in them the values of the Scout Oath and Law. To support Boy Scouts of America, visit www.give2bsa.org.",129944,http://www.BSA.scouting.org/,https://www.guidestar.org/profile/76-6041172
95-4691103,FERTIG FREEDOM FOUNDATION,"The Fertig Freedom Foundation's goals include helping people bring about social progress and justice in their communities as a primary aim, helping people to help themselves.     Given our modest size, the Foundation is unlikely to grant funds to large, established charities, but rather smaller and needier organizations, start-ups and other community-based efforts for which our modest grants will have more significant impact.  Our geographic focus is primarily, but not solely, upon efforts in or affecting communities in California.      We neither solicit nor welcome grants proposals or requests for donations, however we welcome information about on-going community efforts in pursuit of progressive social change towards equal opportunity, public health and education, community development, justice and accountability.",128802,NA,https://www.guidestar.org/profile/95-4691103
20-0856551,Douglas B Gardner Foundation,"The Donation Of Funds To The Brotherhood Sisterhood Organization, And Other 501 C (3) Organizations",128290,WWW.DBGFOUNDATION.ORG,https://www.guidestar.org/profile/20-0856551
45-2654598,Young for Youth Foundation,"The Mission Young For Youth Foundation Are Aimed At Buildinga More Promising Future For Inner-City Children And Teens In Need.The Foundation Plans To Focus On Developing And Supporting Health,Wellness,Athletic And Other Educational Programs For The Under Served, Low Income Children And Teens Living Primarily In The Inner City Areas Of Philadelphia,Memphis And New Orleans.",127416,NA,https://www.guidestar.org/profile/45-2654598
94-2935316,AMERICAN SLAVIC ASSOCIATION,"To sustain the cultural history of our forefathers by celebrating their customs and traditions, yet contributing to the American values and opportunities that originally brought our immigrant families to the United States. Our mission is raising funds for the sole purpose of donating back to local and state non-profit entities such as medical facilities, shelters for the needy, student scholarships, and various other youth programs.",126951,http://www.americanslavicassociation.org,https://www.guidestar.org/profile/94-2935316
23-7373593,Valparaiso Americans Baseball Inc,To Provide And Sponsor Sports Programs.,126175,NA,https://www.guidestar.org/profile/23-7373593
35-1547849,POTAWATOMI PARK INC,"Vision Statement Potawatomi Wildlife Park shall be a place where the natural, historical, and cultural features of the area are conserved, protected, and restored for use and enjoyment by present and future generations.  Mission Statement The mission of Potawatomi Wildlife Park is to: • Maintain a place for low-impact recreation where the public can enjoy the solitude of nature, commune with wildlife, and gain an understanding of local history. • Provide educational programs and opportunities for all people. • Provide a community and regional gathering place.",125011,WWW.GETINTONATURE.COM,https://www.guidestar.org/profile/35-1547849
43-1832781,Top Vietnam Veterans,"TOP (Tours Of Peace) Vietnam Veterans is an independent nonprofit 501(c)3 organization founded in 1998, to help Vietnam veterans and families heal and find closure through Tours Of Peace. The Foundation is comprised of five programs: Veterans, Family, Humanitarian, Personal Effects, and Education. Tours Of Peace trips include an emotional component, while participants revisit old military sites of personal meaning, and conduct humanitarian projects nearby--working to meet the needs of orphans, villagers, and the elderly. In Vietnam, TOP and participants retrieve personal effects, left behind during the war. Upon return, we research and attempt toreturn these effects to families and veterans. TOP educates the public about Vietnam veteran & family issues, the Vietnam War, and Vietnam as it is today.  TOP Vietnam Veterans stands for healing and closure. Ourapproach to veteran & family recovery integrates emotionaland humanitarian components, based on the principal, “byhelping others we help ourselves.”",123494,http://www.topvietnamveterans.org,https://www.guidestar.org/profile/43-1832781
61-1245131,The Stewards Staff Inc,"The Steward's Staff is dedicated to empowering youth & young adults through leadership development,   community engagement and positive reinforcement of self-esteem.",122725,www.stewardstaff.org,https://www.guidestar.org/profile/61-1245131
06-1370390,Manufacturing Jobs Alliance Foundation of CT Inc,"Apprenticeships And Training To Support, Develop And Enhance Manufacturing Technology Throughout Connecticut.",122574,NA,https://www.guidestar.org/profile/06-1370390
20-0548484,The Naqaqa Giving Foundation,"The Naqaqa Giving Foundation fulfills educational, health and emergency needs for Fijians living in remote villages.",120920,www.fijicharity.org,https://www.guidestar.org/profile/20-0548484
75-2812495,Generations Center,Provide research based training and education about the impact of violence in the home upon children and families.  Assist agencies in the development of appropriate prevention and intervention strategies that can address the effects of interpersonal violence upon the child and the family.,120691,NA,https://www.guidestar.org/profile/75-2812495
20-6246872,Pleiades Foundation,Please see our web site.,120303,www.thepleiadesfoundation.org,https://www.guidestar.org/profile/20-6246872
59-3080135,COMMUNITY IMPROVEMENT ASSOCIATION OF SEMINOLE COUNTY INC,"To support the preservation of historical sites and recognition of their African-American founders in Seminole County, provide education and preservation of the African-American culture and heritage, maintain and provide Historic Hopper Academy for these purposes and for the benefit of the community.",119996,HopperAcademy.org,https://www.guidestar.org/profile/59-3080135
45-5572893,Cats Cradle Rescue,"Cat's Cradle Rescue is an all volunteer non-profit rescue group formed to promote the well-being and adoptability of local Portland Metropolitan area cats.  We provide loving foster homes where abandoned and shelter felines can socialize in a family environment while receiving medical care, spay and neuter surgery, with the goal of being adopted into qualified caring homes.",118262,catscradlerescue.com,https://www.guidestar.org/profile/45-5572893
27-1747959,AWAKENINGS,Awakenings is dedicated to making visible the artistic expression of survivors of sexual violence.,117986,www.awakeningsart.org,https://www.guidestar.org/profile/27-1747959
20-3303955,JEANNE FELINE CORP,"Jeanne's Felines was incorporated as a 501(c)3 organization in 2006, after founders George Patrick and Jeanne Polunci decided to turn their dream of saving animals for over seventeen years into a reality.  Jeanne's Felines provides rescue, rehabilitation, adoption services, and permanent for cats and kittens in need of care.",117106,purrsandpawsrescue.org,https://www.guidestar.org/profile/20-3303955
47-4251351,Global Surgical and Medical Support Group Corp,"The Global Surgical and Medical Support Group (GSMSG) is a registered 501(c)3 charitable non-profit dedicated to providing top-tier surgical and medical instruction/services for free in high-threat environments and conflict zones around the world.  Our primary goals are to    -Create long term solutions by educating and training indigenous medical personnel in the latest standards of care and protocols from basic aide and tactical casualty care to invasive surgical procedures.   -Directly provide surgical and medical services by performing procedures and running medical clinics at no cost for populations in need.  -Build up destroyed or non-existent medical infrastructure.  -Develop sustainable, humane, and healthy housing solutions for refugees facing long term displacement.  -Directly deliver aid and assistance to persecuted populations.    GSMSG provides all of these services and more regardless of race, ethnicity, religion, or creed and is free of cost to those receiving our support.",116883,www.gsmsg.org,https://www.guidestar.org/profile/47-4251351
30-0220840,Fort Worth Cops for Kids,"The FWPOA Cops for Kids program is a 501(c) (3) non-profit organization founded in 2003, and through private funding, has served over 5000 disadvantaged children in the Fort Worth Community by providing gifts to those children in local hospitals, scholarship opportunities, school supplies, and social activities. Cops for Kids demonstrates local law enforcement's continued concern for the children in our community by encouraging them to have stronger family relationships, making quality friends, and to continue their education. There is a tremendous need for community and business support that will allow the FWPOA to be there for the kids throughout the year. Your generosity, through donations and sponsorship, is vital to our efforts and continuing success.",116542,www.fwcops4kids.com,https://www.guidestar.org/profile/30-0220840
86-0743467,The Williams Institute,"TWI assists organizations and agencies in building stronger ethical cultures through empowering individuals and developing ethical leaders.  TWI's mission is to help young people and adults Judge what is right, Care deeply about what is right, and Do what is right.  We do this though training, personal and organizational ethical competency assessments, and research that develop  ethical decision making and communication skills in individuals and organizations.  These encourage ethical leadership and grow ethical cultures at work, community and home. TWI focuses on encouraging personal responsibility, calling forth and supporting the processes of ethical thought and decision making within each of us as individuals that, collectively, lead to an ethical community.",114806,www.ethics-TWI.org,https://www.guidestar.org/profile/86-0743467
04-3664898,Community Potential Inc,"Community Potential's Mission Is To Increase The Number Of Available Housing Units In Binghamton And Broome County Through The Construction Of New Low-Income Housing, And To Improve And Renovate Sub-Standard Properties. The Corporation Will Also Assist Low And Moderate-Income Families In Searching For And Financing Single-Family Housing Through Workshops And Counseling As Well As Assistance In Borrowing Funds. In Addition, Provide Programs, Projects",114013,NA,https://www.guidestar.org/profile/04-3664898
84-0410141,Palomino Mounted Patrol,"HORSE RESCUE AND HORSE EDUCATION PROGRAMS FOR CHILDREN(INCLUDING HANDICAPPED) To provide horseback riding to kids with special needs all while having fun on horses. Provide instructor to student riding lessons using fun & games to help these special kids develope core strength, balance, muscle memory, better motor skills, self confidence & another life skill.",112908,NA,https://www.guidestar.org/profile/84-0410141
04-6053493,Karin Grunebaum Cancer Research Foundation,"The Foundation helps junior medical faculty members pursue a career in cancer research which they otherwise would not be able to afford. It also funds initial cancer research projects so researchers can qualify for NHS grants.     The Foundation also sponsors a ""boot camp"" for Harvard University Ph.D. candidates interested in cancer research.",112872,www.grunebaumfoundation.org,https://www.guidestar.org/profile/04-6053493
05-0523378,Melvin Weinstein Parkinsons Foundation Inc,"Assists Parkinson's Patients By Providing General Assistance To Patients With Parkinson's Disease. The Foundation Provides Medical, Equipment, Prescription Drugs, Assistance With Medical Appointment Bills, Household Expenses On A Temporary Basis, And General Short Term Assistance For Patients Between Loss Of Their Jobs And The Commencement Of Disability Benefits.",112414,WWW.MWPF.ORG,https://www.guidestar.org/profile/05-0523378
34-1982414,"Kevin J Hannaford Sr. Foundation, Inc","The Foundation named for Kevin J. Hannaford, Sr., who tragically died along with thousands of others on September 11, 2001, during the brutal terrorist attacks on the World Trade Center in New York. We are keeping Kevin’s memory alive and helping our community by contributing to the educational needs of bereaved children. It is our mission to assist these beautiful children in their educational endeavors financially.",110972,www.kevinhannaford.org,https://www.guidestar.org/profile/34-1982414
77-0529657,Firelight Endowment,The mission of the Firelight Foundation is to improve the well-being of children made vulnerable by HIV/AIDS and poverty in Sub-Saharan Africa. Firelight supports grassroots organizations that help families and communities meet the needs of their children.,110259,http://www.firelightfoundation.org,https://www.guidestar.org/profile/77-0529657
46-4088434,Bamalax Inc,"To Deliver A Unique Experience For Our Players And Parents, Provide A Consistent Athletic And Lacrosse Development Methodology Across All Of Our Teams, Offer World Class Recruiting Resources And Exposure, And Do It All At The Lowest Possible Cost Point.",109209,WWW.BAMALAXSELECT.COM,https://www.guidestar.org/profile/46-4088434
20-0334006,Envirofit International Ltd,"Envirofit evolved from research at the Colorado State University Engines and Energy Conversion Laboratory (EECL), a world leader in designing energy-efficient, low-emissions engines.  Founded in October 2003, our mission is to bring cleaner technologies to the developing world. Envirofit uses a participatory development approach, delivering appropriate technologies and viable business models to attack chronic environmental problems such as air pollution.  An estimated 3?6 million people die each year as a result of air pollution. Because of the chronic nature of air pollution, and the fact that its impacts fall disproportionately on the poor, it is not always recognized for its pervasive role in poor health, poverty and economic stagnation.",106514,www.envirofit.org,https://www.guidestar.org/profile/20-0334006
36-3996036,Unicorn Children's Foundation,"This organization has been dissolved and currently operates as The Unicorn Children's Foundation, Inc (57-1168205) whose mission is assisting children and young adults with developmental, communication, and  learning disorders through education, awareness, and research.",106180,www.unicornchildrensfoundation.org,https://www.guidestar.org/profile/36-3996036
04-2754324,James Underwood Crockett Agricultural Technology Growth Fund,"The trustees of the JUC/ATG Fund make annual grants to support the growth of agricultural technology in the northeast (NE) U.S.A.  As the NE has a large population, generally poor soil and a short growing season, there is a need to develop ways to produce more food more efficiently in our local area.  Currently the majority of food to be consumed in the NE is transported from the west and south.  In time of natural or other disaster, transportation of food may be hindered.  The JUC/ATG Fund has and shall continue to raise the corpus from external solicitation for new donations and from internal reinvestment of earnings not used for annual granting.",105583,NA,https://www.guidestar.org/profile/04-2754324
20-2727759,"Castanea Foundation, Inc.",To conserve agriculturally productive and environmentally significant land and water resources throughout Vermont and select areas of New York.,104851,www.castaneafoundation.org,https://www.guidestar.org/profile/20-2727759
01-0537471,Planet Dog Foundation,The mission of the Planet Dog Foundation is to promote and celebrate programs in which dogs serve and support their best friends.,104743,www.planetdogfoundation.org,https://www.guidestar.org/profile/01-0537471
86-0933652,O2 For Life  Rainforest Foundation,"Our mission Statement: - To protect the tropical rainforest in our nature reserve in Costa Rica. - To promote conservation awareness and the study of tropical nature among young people through ""hands-on"" field education at out reserve. We practice conservation through education.",104515,NA,https://www.guidestar.org/profile/86-0933652
20-0712233,Kindred Spirits Sanctuary Inc,"At Kindred Spirits Sanctuary, farm animals are our friends, not our food. Kindred Spirits is currently home to almost 150 rescued farm animals from all over the United States. Our residents come to us from abuse and neglect cases, factory farms or because they have a special need. At KSS these animals have found their forever home where they will be free from pain and suffering and from ever being used for food!    Kindred Spirits is a non-profit 501(c)(3) tax-exempt organization, dedicated to ending the abuse and suffering of farm animals through direct rescue, advocacy and education. We seek to provide a place where people can connect with these sentient beings and discover their unique (and often humorous!) personalities.",104441,www.kindredspiritssanctuary.org,https://www.guidestar.org/profile/20-0712233
22-3169079,Toms River Little Indians Inc,"Provide Suitable Instruction, Competition, Fields & Facilities For Youth Football And Cheerleading Activities. Services Provided By Volunteers.",103573,HTTP://WWW.TRLI.ORG/,https://www.guidestar.org/profile/22-3169079
56-1621520,"Special Operations Response Team, Inc.","SORT's members are skilled  volunteers that provide medical assistance to the community, the state, and the  nation in times of crisis.  SORT's mission is  to provide the highest level of disaster medical support through education,  research and response.",103382,http://www.sortteam.org,https://www.guidestar.org/profile/56-1621520
20-3308712,Stop Child Predators Partnership,"Stop Child Predators Partnership Is A Non-Profit Organization In Washington, Dc That Combats The Sexual Exploitation Of Children And Promotes The Rights Of Crime Victims.",103083,WWW.STOPCHILDPREDATORS.ORG,https://www.guidestar.org/profile/20-3308712
46-4485637,Operation Northern Comfort,Operation Northern Comfort is an organization of volunteers empowering and giving hope to those in need.,101635,operationnc.org,https://www.guidestar.org/profile/46-4485637
36-4242179,Gratiot Lake Conservancy,To conserve the natural environment of Gratiot Lake and its  watershed and environs. To promote informed land stewardship through education  and research related to the ecology and history of the lake and its environs.,101343,http://gratiotlakeconservancy.org,https://www.guidestar.org/profile/36-4242179
