EIN,Organization,Mission,Receipts,URL,Guidestar
95-3119081,FOUNTAIN THEATRE,"The Fountain Theatre provides a supportive home for theatre and dance artists of diverse ethnic, cultural and economic backgrounds toward the creation of new work that illuminates the communities from which they are drawn, giving artistic voice to many who may not otherwise be heard. The Fountain Theatre is deeply committed to creating, developing and producing new plays by important new playwrights and established masters in the American Theatre that inspire and express the immediate issues and cultural diversity of Los Angeles and the nation. Dedicated to engaging students through its educational outreach programs, the Fountain Theatre enriches the lives of young people by making the life-enhancing experience of live theatre accessible to new audiences.",608706,www.fountaintheatre.com,https://www.guidestar.org/profile/95-3119081
54-1921691,World Future Fund Inc,"We are a nonpartisan source of organized documentary information.  We have created one of the best global future watch indicators systems in the world.  We also provide important documentary information relating to religion, political philosophy and culture.",607124,http://www.worldfuturefund.org,https://www.guidestar.org/profile/54-1921691
63-6194402,Alabama Family Charitable Tr,Assets Are Used To Provide Benefits To Individuals With Qualifying Impairments,606046,www.alabamafamilytrust.com,https://www.guidestar.org/profile/63-6194402
52-1684353,The Pet Care Trust,"TO PROMOTE PUBLIC UNDERSTANDING OF THE VALUE OF AND THE RIGHT TO ENJOY COMPANION ANIMALS, TO ENHANCE SOCIETY'S KNOWLEDGE ABOUT COMPANION ANIMALS THROUGH RESEARCH AND EDUCATION, AND TO PROMOTE PROFESSIONALISM AMONG MEMBERS OF THE COMPANION ANIMAL COMMUNITY.",605773,petcaretrust.org,https://www.guidestar.org/profile/52-1684353
33-0946827,TOBY WELLS FOUNDATION,Toby Wells' Blue Apple Ranch brings youth and animals together through innovative programs that build both compassion and responsibility while connecting with nature.,605724,www.tobywells.org,https://www.guidestar.org/profile/33-0946827
65-0294494,Palm Beach Pops Inc,"In A Unique Orchestral Focus, The Palm Beach Pops' Founding Board Of Directors Articulated The Following Organizational Mission,* To Preserve The Heritage Of America's Great Composers And Lyricists, To Celebrate The Great Performers Of The Past And Present * To Further Enhance The Entertainment Art From That Is Truly Unique - The American Musical, To Perform The Music Of Broadway, Of Hollywood And The Music Recorded By The Great Legends Of Our Time* To Encourage A Greater Appreciation",605257,WWW.PALMBEACHPOPS.ORG,https://www.guidestar.org/profile/65-0294494
61-0444776,Maysville & Mason County Library Historical & Scientific Association,"The Kentucky Gateway Museum Center educates visitors by offering dynamic  collections, exhibits, and a genealogical-historical library.    The Kentucky Gateway  Museum Center is the operating entity of the Maysville and Mason County  Library, Historical and Scientific Association. Founded in 1878 when a local  merchant, James Wormald, of English origin, in order to express his gratitude  for the manner in which the citizens of Maysville had welcomed him to their  community, made a contribution of $2000 to fund ""the establishment, promotion,  and preservation of an institute in said city, uniting the advantages of a  public library with those of a historical and scientific society.""  Kentucky Gateway Museum Center is a not-for-profit membership organization of  private citizens concerned with preservation of historical information about  their region.  Collections can be divided into four primary categories:  archives, artifacts, exhibits and art. The Association was chartered by the  State of Kentucky on March 1, 1878 and is said to be the oldest state  historical organization in continuous existence.",605073,http://www.KYGMC.org,https://www.guidestar.org/profile/61-0444776
52-1953383,The Monocacy Foundation Inc,"We firmly believe that people with developmental disabilities have the right to a life enriched with social and recreational opportunities, preferences for where and with whom they live and dignity in dying.",604999,communitylivinginc.org/monocacy,https://www.guidestar.org/profile/52-1953383
71-0936565,3Rs Group Home Inc,Residential Care And Treatment Of Emotionally And Physically Neglected Children,604359,NA,https://www.guidestar.org/profile/71-0936565
35-2185292,Institute for Truth in Accounting,"To Educate And Empower Citizens With Understandable, Reliable, And Transparent Government Financial Information.",594325,WWW.TRUTHINACCOUNTING.ORG,https://www.guidestar.org/profile/35-2185292
01-0567224,Sunny Meadows Foundation,"MISSION STATEMENT  Our purpose for founding Sunny Meadows...Safe Haven for Pets:  In a world of staggering, heart breaking numbers of pets euthanized each year, to offer safety from the cruel reality for as many pets as possible.  Enhance, nurture and extend the value of life in stray, injured, unwanted and abused pets.  Dedicated to successfully placing our rescued pets in conscientious, compassionate and everlasting, loving homes.  Reduce unwanted litters by educating, influencing, promoting and organizing sterilization programs.  Reduce relinquishment of companion animals by promoting preventative medical care, promoting compatibility in the selection of a pet, to educate responsible pet ownership, to offer resources and advice on behavioral issues, and ultimately promoting the benefits of having a cherished, loving pet.",594172,http://www.sunnymeadows.org,https://www.guidestar.org/profile/01-0567224
20-5885567,"Second Family Foundation, Inc.","Second Family Foundation is a non-profit organization, funding the Second Family Program that fosters and nurtures self-development of adolescent, foster care youth in Orange County.  For Second Family, discipline is not about rules but about a way of life and as such we strive to inculcate ""ways of life"" appropriate to the giving back message.",592904,NA,https://www.guidestar.org/profile/20-5885567
04-2104810,Girdler House,"Girdler House mission is to provide a safe, healthy, efficient and inviting home to a possible 15 female senior residents on a 24-hour basis. The Board of Managers and employees, responsible for executing this mission   successfully, continue the Home Society's legacy by ensuring that residents enjoy a dignified setting in which they may live out their years, as well.  The Old Ladies Home Society's original founders were from some of Beverly's leading families, and were concerned to provide a dignified home for the aging mothers' helpers they had grown up with. In 1900, five elderly ladies began their residence in a small house near our current location. Many more women were interested, but turned away because of the small size of the property purchased. Subsequent community support and interest from church groups, individuals and businesses allowed The Old Ladies Home Society to buy and refit the Beverly Inn property at 78 Lothrop Street, accommodating 15 residents beginning in 1919. In 1967 The Old Ladies Home Society adopted Girdler House as their business name, and in 1983 the Board of Managers adopted the policy to fill vacant rooms with ambulatory women in good physical and mental health, over 60 years of age, who were or had been residents of Beverly or surrounding communities, on the payment of a stipulated weekly sum, the Home assuming none of their medical or personal expenses.",590751,www.girdlerhouse.com,https://www.guidestar.org/profile/04-2104810
27-2910626,Preservation Hall Foundation,"The mission of the Preservation Hall Foundation is to protect, preserve and perpetuate the musical traditions and heritage of New Orleans.    “Tradition"" is not just a body of knowledge. It is the personal bond between generations of practitioners that allows culture to be transmitted and made meaningful to the present. A living tradition holds personal meaning for people of all ages, organizes important lifeways, and offers practitioners a connection to something shared in history and community. Thriving local tradition engages people from cradle to grave. With this in mind, we take the following approach to our mission:    We PROTECT the future of New Orleans' musical traditions, providing music instruction and mentorship from senior culture-bearers. Our education and outreach programs specifically target underserved schools and neighborhoods with no previous music programming.    We PRESERVE the history of Preservation Hall's artistic community through our archives, oral history work and content collaborations with the Preservation Hall collective of musicians, so that the tradition may evolve in meaningful ways for the present.    We PERPETUATE our traditions by recognizing New Orleans' musical culture-bearers, supporting them in their later years with a Legacy program that employs elders of the jazz community to perform and teach music to the next generation.",589750,http://preshallfoundation.org,https://www.guidestar.org/profile/27-2910626
13-6041301,J D Rockefeller Jr Tr Fbo American Baptist Churches-Metropolitan NY 2,This Trust Supports The American Baptist Church,586212,N/A,https://www.guidestar.org/profile/13-6041301
37-1091053,The Nature Institute,"The Nature Institute's mission is to foster an awareness and appreciation of the natural world through preservation, restoration, and education.",584346,https://www.thenatureinstitute.org/,https://www.guidestar.org/profile/37-1091053
94-6449253,Elia Whittell Trust for Disabled Veterans of Foreign Wars,"Our mission is to 'honor the dead by helping the living' through veterans' service, community service, national security and a strong national defense.",582740,www.vfw.org,https://www.guidestar.org/profile/94-6449253
71-0846567,Arkansas State Police Foundation,"The Arkansas State Police Foundation financially supports the State Police and its employees to fulfill their mission, “to protect human life and property in the State of Arkansas.”  • Providing life protecting equipment, training and continuing education when state and federal funding streams are not sufficient Supporting many local programs and community outreach to increase public confidence and understanding of police activities. • Supporting many local programs and community outreach to increase public confidence and understanding of police activities. • Assisting employees and their families through tough times by contributing to funeral expenses, lodging, food and any other expense.",579368,www.aspfoundation.com,https://www.guidestar.org/profile/71-0846567
81-0992982,Lamar Ambulance Service Inc,City Ambulance Service,569589,NA,https://www.guidestar.org/profile/81-0992982
26-3644986,LIONSHARE EDUCATION ORGANIZATION INC,"LEO Zoological Conservation Center is a nonprofit, off exhibit, accredited breeding reserve, in Greenwich, Connecticut, for rare and endangered animals with a focus on breeding species at risk. Scientific conservation based research and education are the cornerstones of the center’s efforts. We are dedicated to preserving our natural world and inspiring others to save the animals of today for the people of tomorrow.  Deeply committed to sustainable conservation, LEOZCC also offers its students,  researchers, Special Cause Groups, and supporting members the unique opportunity to learn and interact with some of the world’s most rarest animals and discover how the center is working to restore nature’s precious balance.",569405,leozoo.org,https://www.guidestar.org/profile/26-3644986
43-1269698,Mary Lou Shannahan Animal Cruelty Prevention,This Foundation provides funds to various animal welfare organizations.,568195,NA,https://www.guidestar.org/profile/43-1269698
95-3927250,Soroptimist Gardens Housing Corporation,"Founded in 1921, Soroptimist International of the Americas is an international organization for business and professional women who provide volunteer service to their communities. About 45,000 Soroptimists in 20 countries and territories contribute time and financial support to community-based and international projects benefiting women and girls. Soroptimist International of the Americas is part of Soroptimist International, which comprises almost 95,000 members in about 120 countries.  The name, Soroptimist, means 'best for women,' and that's what the organization strives to achieve. Soroptimists are women at their best working to help other women to be their best.  Soroptimist members belong to local clubs, which determine the focus of service to their communities. Club projects range from renovating domestic violence shelters, to providing mammograms to low-income women, to sponsoring self-esteem workshops for teenage girls. In addition, Soroptimists participate in organization-wide programs that include the Women's Opportunity Awards, Soroptimist Club Grants for Women and Girls, the Soroptimist Workplace Campaign to End Domestic Violence, the Making a Difference for Women Award and the Violet Richardson Award. All projects seek to make life better for women and girls, in local communities and throughout the world.",567354,http://www.soroptimist.org,https://www.guidestar.org/profile/95-3927250
61-1149642,Mary E Wharton Nature Sanctuary at Floracliff Inc,"Floracliff's mission is to care for the sanctuary property, ensure its protection as a nature preserve and promote public education of the natural history of the Inner Bluegrass region. In its stewardship, the directors are guided by principles laid down by Floracliff's founder, Dr. Mary E. Wharton.",565781,www.floracliff.org,https://www.guidestar.org/profile/61-1149642
46-3053232,Ceca Foundation,"Ceca Foundation was established in 2013 to celebrate caregiver excellence.  Our mission is to promote high patient satisfaction by recognizing and rewarding outstanding caregivers. Ceca is a 501(c)3 Private Operating Foundation, devoting its resources to the active conduct of charitable activities.",563875,https://cecafoundation.org/,https://www.guidestar.org/profile/46-3053232
77-0698917,The Redwoods Group Foundation Inc,The Redwoods Group Foundation is a backbone organization that staffs and supports collaborative efforts to prevent child sexual abuse and drowning.,559307,www.redwoodsgroupfoundation.org,https://www.guidestar.org/profile/77-0698917
35-1891452,J. Cox Family Foundation,"By invitation only, the JCFF accepts grant requests from and desires to fund local organizations whenever possible that are not funded by national groups (like United Way).  The JCFF wants to help the poor and distressed; to help children  (born and unborn) in trouble; to promote the dignity of life; to help families in crisis; to further research that is in the best interest of improving the people's lives; to promote Christianity.",555714,NA,https://www.guidestar.org/profile/35-1891452
27-0384819,Y God Institute,To Promote The Truth Of Christianity To Christian Students (Ages 16-24) By Educating Students And Answering The Most Provocative Questions About Christianity Aimed At Them By Society.,554863,YGODINSTITUTE.ORG,https://www.guidestar.org/profile/27-0384819
47-2817949,THE SPECIALIZED FOUNDATION,"The Specialized Foundation uses cycling as a tool for children to achieve academic, health and social success. Through investments in primary scientific medical research and school-based cycling programs, our mission is to increase accessibility to cycling to aid youth in personal development and education.",554802,SpecializedFoundation.org,https://www.guidestar.org/profile/47-2817949
47-3091614,Good Work Institute,The Good Work Institute is a 501(c)3 Public Charity with a mission to educate and connect a network of local community members and actively support their collaborative efforts to regenerate their places.,547490,www.goodworkinstitute.org,https://www.guidestar.org/profile/47-3091614
13-7104759,Mechner Foundation,To Provide Educational Facilities Through The Queens Paideia School.,543089,WWW.MECHNERFOUNDATION.ORG,https://www.guidestar.org/profile/13-7104759
46-1588898,RCU FOUNDATION INC,To create a positive impact in the lives we touch.,542192,https://www.rcu.org/about-us/royal-credit-union-foundation,https://www.guidestar.org/profile/46-1588898
95-4600537,Psalm & Proverbs of the Potters House,"Promoting The Homeless From Homelessness To Home Ownership, And For Creation.",539756,NA,https://www.guidestar.org/profile/95-4600537
45-4064567,Autobahn Soccer Community,""""""""""""""""" *",535416,www.autobahnsoccer.com,https://www.guidestar.org/profile/45-4064567
93-1286389,New Priorities Child Refuge,Providing counseling and educational services for at-risk youth and their families.,535282,www.mynewpriorities.org,https://www.guidestar.org/profile/93-1286389
33-0142788,MT Carmel Hs Athletic Foundation,"The mission of the Mt. Carmel HS Athletic Foundation (MCAF) is to fund athletic projects at Mt. Carmel High School (MCHS) in San Diego, California and to support MCHS athletics through MCAF and booster club fundraising efforts.    MCAF is a 501(c)3 non-profit corporation.  MCAF is governed by a Board of Directors comprised of parents and community leaders who serve without compensation.    Membership is open to any interested adults.  We encourage all sports to be represented.  Any person wishing to be an associate member representing a sport, needs to be approved by the varsity coach of that sport, attend a MCAF meeting, request to be seated and then voted in by the present associates.  To be a voting associate, you need to be seated.",533395,www.mtcarmelathleticfoundation.org/,https://www.guidestar.org/profile/33-0142788
27-3190444,Appalachain Stewardship Foundation,"The vision of the ASF is for environmental values to lead our energy future -- clean streams, clear skies and a stable climate, with the energy we need. To accomplish this vision, ASF plans to fund innovative projects that remedy or mitigate the impacts of energy development in Appalachia by: reducing greenhouse gases, restoringstreams and fisheries, and promotingpublic awareness.",523753,NA,https://www.guidestar.org/profile/27-3190444
27-0046804,Maestro Community Development Corporation,To improve lives in the greater New Jersey area through the pursuit of community revitalizing development activities.,519552,www.lbhousing.org/maestro,https://www.guidestar.org/profile/27-0046804
84-1461821,"Code 3 Associates, Inc.","Code 3 Associates, Inc. is dedicated to both professional disaster reponse for animal needs and to training individuals involved in animal related law enforcement and emergency response. We work in partnership with all qualified organizations involved in disaster relief to help animal welfare and public safety professionals increase public awareness and preparedness for disasters. Our goals are accomplished by two means: First, by hands-on animal rescue operations during disaster events in the United States and Canada; and second, with our own training seminars and classes.",519326,www.Code3Associates.org,https://www.guidestar.org/profile/84-1461821
95-4742110,Promises Foundation,"The mission of the Promises Foundation is to keep families together by empowering them with life skills needed for a drug and alcohol abuse-free future. Promises fulfills its mission by providing the women and children at Miriam's House with a sober, safe and nurturing environment, providing resources for parenting and life skills to facilitate long-term sobriety and a successful future for them and their families.",517995,www.promisesfoundation.org,https://www.guidestar.org/profile/95-4742110
13-3676166,Mitsubishi International Corporation Foundation,"The mission of the MIC Foundation is to motivate ""at risk"" young people through programs that build upon their natural curiosity about the environment, the arts, economics, and basic education.  We hope to enrich their lives by supporting the efforts of specialized institutions carrying out high-quality educational outreach programs.",506834,NA,https://www.guidestar.org/profile/13-3676166
27-5199898,Highway58,See Schedule O,505251,NA,https://www.guidestar.org/profile/27-5199898
57-0904542,Southern Institute On Children and Families Inc,"Founded in 1990, the Southern Institute on Children and Families is a non-profit  organization dedicated to improving the well-being of children and families,  especially those who are economically disadvantaged.  We create opportunities to  meet basic needs through achievement of innovative, research-based policies,  effective policy implementation and efficient service delivery.",504350,www.thesoutherninstitute.org,https://www.guidestar.org/profile/57-0904542
26-3841119,Loving All Animals Inc,"Loving All Animals serves as a catalyst amongst the many and diverse animal welfare organizations in the Coachella Valley and Southern California, for the benefit of companion animals.  We are keenly focused and lead the community awareness campaign for the creation of a No Kill Community.  We host dog and cat adoption events, and offer shelter tours so that people can adopt a shelter animal.",501278,www.lovingallanimals.org,https://www.guidestar.org/profile/26-3841119
39-1739567,Methodist Manor of Waukesha Inc,"The Corporation's Primary Purpose Is To Relieve The Distress And Respond To The Needs Of The Elderly. The Corporation Is Designed To Meet One Or More Of The Needs Of The Elderly, Including Their Medical, Spiritual, Physical, Social, And Psychological Needs, To Assist The Elderly In Living Independently And With Dignity, And To Provide Health Care Services To The Elderly.",500534,WWW.VMPCARES.COM,https://www.guidestar.org/profile/39-1739567
95-2657733,Baptist Gardens,Providing Affordable Housing And Healthcare Facilities To Seniors And Handicapped Persons.,493139,www.baptistgardens.org,https://www.guidestar.org/profile/95-2657733
45-3309167,HELP BETTER LIVES INC,"Better Lives' mission is to help children grow up healthy, educated, and trained to earn an income so they can support a family of their own.",488659,www.betterlives.org,https://www.guidestar.org/profile/45-3309167
23-2947850,Renfrew Center Foundation,"The Renfrew Center Foundation, founded in 1990, is a non-profit, 501(c)(3) organization dedicated to advancing the education, prevention, research and treatment of eating disorders.  Through its programs, the Foundation aims to increase awareness of eating disorders as a public health issue and research the pathology and recovery patterns of people with eating disorders. The Foundation also seeks to educate professionals in the assessment, treatment and prevention of behavioral and emotional disorders by sponsoring an Annual Conference as well as numerous seminars throughout the country.  The Renfrew Center Foundation is committed to help women and girls on the road to recovery by providing financial assistance to those who might otherwise not be able to afford treatment.  The Foundation is supported financially by private donations as well by funding from The Renfrew Center.     The Renfrew Center was established in 1985 in Philadelphia, as the first free-standing, residential treatment facility in the United States exclusively dedicated to the treatment of women with eating disorders.  In 1990, The Renfrew Center established a second residential treatment facility in Coconut Creek, Florida. Today, The Renfrew Center provides residential and outpatient services in Philadelphia and Bryn Mawr, Pennsylvania; Allendale, New Jersey; New York City, New York; Wilton, Connecticut; and Coconut Creek and Miami, Florida.   The Renfrew Center has helped more than 30,000 women with eating disorders and other psychiatric conditions.  The treatment philosophy emphasizes a respect for the unique psychology of women, the importance of a collaborative therapeutic relationship, and the belief that every woman needs to actively participate in her own recovery.   Professionals, alumni, families and friends can become more involved with The Foundation?s efforts through volunteering, individual donations and planned giving opportunities.  With your help, together we can build a future where women, girls, and their families have the hope for a healthy life free from eating disorders and body image issues. For information about The Renfrew Center?s services and supporting The Renfrew Center Foundation, please call toll-free 1-877-367-3383 or visit www.renfrew.org.",488485,http://www.renfrew.org,https://www.guidestar.org/profile/23-2947850
42-1665047,Allen Eagle Athletic Booster Association,The Athletic Booster Club Is A High School Organization That Promotes The Welfare Of Its Student Athletes At Allen High School.,487227,NA,https://www.guidestar.org/profile/42-1665047
27-4629468,Tampabay-Job-Links Inc,"Bringing community together to help people find jobs.    As a 501(C )3 non-profit organization, TampaBay-Job-Links (TBJL) offers job seekers individualized job search support services and opens doors to networking and employment opportunities. We take a holistic approach to client services and address job search and employment barriers directly and through referral to community resources.     We work closely with employers to assist them with their hiring needs and provide them with qualified pre-screened candidates. By preparing job seekers with the skills necessary to conduct an effective job search, by mobilizing the community, and by opening doors to business and community leaders, we help people find jobs.     The services of TBJL are available to all individuals without regard to race, religion, ethnicity, gender, age, national origin, or sexual orientation.",486920,www.TampaBay-Job-Links.org,https://www.guidestar.org/profile/27-4629468
